{"$schema":"https://json-schema.org/draft/2020-12/schema","title":"SaySol sandbox capsule evidence","type":"object","required":["sandbox","repository_sha","capsules","results","recorded_at","logs"],"properties":{"sandbox":{"type":"object","required":["baseline_version","serenity_version","clean_baseline"],"properties":{"baseline_version":{"type":"string"},"serenity_version":{"type":"string"},"clean_baseline":{"enum":["PASS","FAIL"]}}},"repository_sha":{"type":"string","minLength":7},"capsules":{"type":"array","items":{"type":"object","required":["id","version"]}},"results":{"type":"object"},"recorded_at":{"type":"string","format":"date-time"},"logs":{"type":"array","items":{"type":"string"}}}}
