{"sandbox":{"baseline_version":"1.0.0-candidate.1","serenity_version":"10.5.2","clean_baseline":"FAIL"},"repository_sha":"REPLACE_WITH_GIT_SHA","capsules":[{"id":"REPLACE","version":"REPLACE","sha":null}],"results":{"installation":"NOT_RUN","backend_build":"NOT_RUN","frontend_build":"NOT_RUN","migration":"NOT_RUN","functional":"NOT_RUN","security":"NOT_APPLICABLE","cleanup":"NOT_RUN"},"recorded_at":"1970-01-01T00:00:00Z","logs":[]}
